<!ELEMENT articulos (articulo+)>
<!ELEMENT articulo (nombre, precio, codigo, fabricante)>
<!ELEMENT nombre (#PCDATA)>
<!ELEMENT precio (#PCDATA)>
<!ELEMENT codigo (#PCDATA)>
<!ELEMENT fabricante (#PCDATA)>
